id,clean_text,target,text_length
8205,to all the meatloving feminists of the world riot grill hasarrived,0,66
8208,seriously do we have to do a tactical riot against the headquarters of disney and marvel,0,88
8209,keep an eye out well be looking for lots of new team members in coming daysweeks,0,80
8210,to all the meatloving feminists of the world riot grill has arrived pop quiz which do you prefer feminist,0,105
8211,selfie at booth or riot kappa,1,29
8212,ill start a big ass riot  send me to jail today mfs shidddd,0,59
8213,riot kit bah  part of the new concept gear coming for autumnwinter menswear fashion urbanfashion,0,96
8214,discovered by    listenbuy  riot on     blowmandyup,0,51
8215,i liked a  video  thorins thoughts  riot and sandbox mode lol,0,61
8216,stuart broad takes eight before joe root runs riot against aussies stuart broad took careerbest figures of 8,0,108
8217,retweeted sarah silverman   soundtrack of my walk starts w tracey ullman they dont know  perfect,0,96
8218,to all the meatloving feminists of the world riot grill has arrived,1,67
8219,after all that time riot should really make an official satan teemo skin,0,72
8221,i liked a  video  sick riot shield slide spots,0,46
8223,torrecilla we always info the secret on lol game check the secret to get 600000 riot points on my bio,0,101
8224,transwomen and drag queens of color lead the riot a well known butch lesbian is usually credited for inciting it,0,112
8225,you can now preorder the film on itunes amp watch 915 yay,0,57
8226,without an ally near you cant use this skill how did you get hired really cause its making every riot staff member look incompetent,0,131
8231,pop quiz which do you prefer feminist revolution or fried ravioliwith porcini and ricotta,0,89
8232,to all the meatloving feminists of the world riot grill has arrived  oliviamiles01,0,82
8234,except we dont know who started the riot or if it even makes sense to credit any particular individuals,1,103
8235,juan carlos salvador the secret tips to get 100000 riot points lol are out now check the secret on on my bio,0,108
8236,southeast dirt riot series crowns champions  southeast dirt riot series crowns championsblackfoot id the so,0,107
8237,sweetpeas are running riot at the allotment  and brightening up a rainy day,1,75
8238,stuart broad takes eight before joe root runs riot against aussies,0,66
8239,riot police intervene after southampton and vitesse arnhem supporters clash  fans clash in buildup to second,1,108
8240,discovered by    listenbuy  riot on     blowmandyup,0,51
8241,cracker  white riot   nowplaying,0,32
8242,but the government will not care police will stop rioting eventually of protestors eventually some skyscrapers become plantcovered,1,130
8243,new doco tonight at 9pm setanta sports ireland freeview the largest police presence at a soccer game in ireland stop prevent the rioting,0,136
8244,eric clapton shot the sheriff in 1974 and guess how many people were rioting right none,1,87
8245,if they kill off val im rioting emmerdale,0,41
8246,money cant buy happiness is just a lie we tell poor people to keep them from rioting,1,84
8247,bloody hell its already been upgraded to rioting hyperbole saintsfc,1,67
8250,twitter is doing a count down to the rioting and financial collapse of brazil rio2016,1,85
8251,if that would of been a black dude antioch would be rioting,0,59
8252,recently met with the  to discuss race relations in america amp the benefits of rioting loveislove,0,98
8253,people like you should be charged after the inevitable rioting for contributing to it with your lies,0,100
8254,cindy noonanheartbreak in baltimore rioting yahistorical undergroundrailraod,1,76
8256,leeds fan rioting in embra at a lower tier league cup final  dee dum,1,68
8257,still rioting in a couple of hours left until i have to be up for class,1,71
8258,there were plenty of black people rioting when tosu won the championship as well,0,80
8259,the ferguson riots worked this of this the next time you say rioting doesnt change anything  there fixed it for you,1,115
8261,bbcnews the ass of british insurers says rioting will cost insurers  amp163163millions but police numbers are reduced by blind fat contr,1,136
8262,bhramabull watch run the jewels use facts to defend rioting in ferguson the socially minded duo takes on the,1,108
8264,i think twitter was invented to keep us insomniacs from rioting in the wee small hours,0,86
8266,people arent rioting because justice has been served and that murderer is behind bars simple no justiceno peace justicepeace,1,124
8267,still rioting in to gmail,0,25
8270,rioting,1,7
8271,if i dont get my money by tomorrow rioting,0,42
8274,rt  why sweden isnt venezuela there have been a few days of rioting in venezuela with the riots directed at gr,1,110
8276,or the rioting in happy valley after penn state loses,0,53
8278,a group of mascara smeared girls rioting will be horrific i think,1,65
8279,the last time a high profile name was due to be signing for nffc the city was rioting wesley verhoek now a household name dontpanic,1,131
8280,what alternatives legal alternatives protesting rioting may not be the most peaceful thing but its a demonstration of how,0,121
8283,i am so sick of criminals parents and friends rioting when they are killed by police you dont give a damn when officer is,1,121
8284,but the rioting began prior to the decision for the indictment so youre not really making sense at this point,1,109
8285,the ashes test match is currently more interesting than stupid congress rioting,1,79
8286,people rioting everywhere and i think id be one of them  usamisan lt3,1,69
8287,football hooligan jailed for rioting before game in scotland was already banned from matches in england uknews,1,110
8288,cindy noonanheartbreak in baltimore rioting yahistorical undergroundrailraod,0,76
8289,am bbcnews the ass british insurers says rioting will cost insurers163millions but police numbers are reduced by blind fat controllers,1,134
8291,i have lived amp my family have lived in countries where looters were shot on sight where rioting wasnt tolerated why here,1,122
8292,refuse to let my life be reduced to rubble when the shit keeps piling up get a shovel,0,85
8294,chinas stock market crash are there gems in the rubble chinas stock market crash this su    via,0,95
8295,if you go on with this nuclear arms race all you are going to do is make the rubble bounce  winston churchill,0,109
8296,chinas stock market crash this summer has sparked interest from bargain hunt,1,76
8297,chinas stock market crash this summer has sparked interest from bargain hunt,0,76
8298,my parents are so impulsive sometimes i remember coming home to my room filled with dust amp rubble just because they wanted it redesigned,0,138
8300,turning rubble from disasters into lego bricks you can build houses with this one belongs in crazyideascollege,0,110
8301,360wisenews  chinas stock market crash are there gems in the rubble,0,67
8304,forbes chinas stock market crash are there gems in the rubble chinas stock market crash this summer ha,0,102
8309,forbes europe chinas stock market crash are there gems in the rubble,1,68
8310,chinas stock market crash this summer has sparked interest from bargain hunters and bulls betting on a rebound d,0,112
8311,again i didnt say it was i was referring to the main 2 buildings 7 was hit by rubble,1,84
8312,chinas stock market crash are there gems in the rubble,0,54
8314,360wisenews  chinas stock market crash are there gems in the rubble,1,67
8315,jun 2015 yemenis search for survivors under the rubble of houses in the old city of sana following an,1,101
8317,chinas stock market crash are there gems in the rubble  forbesasia,1,66
8318,steve buscemi was a firefightr b4 fame amp workd 12hr shifts diggin thru wtc rubble lookg 4 survivors,1,101
8320,chinas stock market crash are there gems in the rubble  tcot p2 news,0,68
8321,chinas stock market crash are there gems in the rubble chinas stock market crash this summer h  by forbes,0,105
8324,i found a diamond in the rubble,0,31
8329,tnn chinas stock market crash are there gems in the rubble,1,58
8330,chinas stock market crash are there gems in the rubble  roimentor yycwalks,1,74
8332,chinas stock market crash are there gems in the rubble,0,54
8334,360wisenews  chinas stock market crash are there gems in the rubble,1,67
8335,new post chinas stock market crash are there gems in the rubble,0,63
8337,chinas stock market crash are there gems in the rubble chinas stock market crash this summer has sparked,0,104
8339,photo postapocalypticflimflam prodding around the rubble,0,56
8341,360wisenews  chinas stock market crash are there gems in the rubble,0,67
8344,damn suh dont let that ruin your year bruh this our year better start carpooling like we did back in the day,0,108
8345,if i cant ruin his mood then i may have lost my direction,0,57
8346,i ruin everything,0,17
8347,quote never let your problems ruin your faith,0,45
8348,im so anxious though because so many ppl will me watching me meet them and that makes me uncomfortable but i cant let that ruin the moment,0,138
8349,smokers that ruin that new car smell,0,36
8350,just wait until your friends at mta ruin it sorrybutitstrue,0,59
8351,im really sad about red 7 closing  yuppies n tourists ruin everything,0,69
8352,always gotta ruin my mood,0,25
8355,i understand you wanting to hang out with your guy friends ill give you your space but dont ruin my trust with you,0,114
8356,like why on earth would you want anybody to be unhappy dont purposely ruin somebody elses happiness,0,99
8360,fresh out da shower lookss  still loving this new hair does it ruin my brand yes,0,80
8361,see tryna ruin my life,0,22
8362,well done me everyone applaud me and how terrific i am and how i never ruin anything,0,84
8363,four things that may ruin your personal injury accident claim,1,61
8364,how to ruin the holidays in 3 wordk its a zmne,0,46
8365,every time i have a really good day someone just has to ruin it,0,63
8366,you wanna ruin a relationship just ask what are your intentions and youll do it,0,79
8367,and then i go a ruin it all with something awful minions,0,56
8368,it was really awful and i cant even work with a make up artist now because they will ruin things,0,96
8369,damn wale knows how to ruin a song,0,34
8370,cause you play me like a symphony play me till your fingers bleed im your greatest masterpiece you ruin me,0,106
8371,why does my family have to ruin something that is actually going good for me,0,76
8372,i hate that im so awkward and i ruin things,0,43
8374,long road to ruin  foo fighters,0,31
8375,why do u ruin everything   u ruined the sour cream and u put a brick of cheese in the freezerdummy,0,98
8377,dont let a few assholes ruin your night,0,39
8378,lol the real issue is the the way the nfl is trying to ruin this guys legacy,0,76
8382,rt to ruin  s day,0,17
8383,greedy bastards  way to ruin creativity  censorship on youtube,0,62
8385,she shouldnt being with them is gonna ruin her game and vanessa is a great player,0,81
8386,yes yes i will i dont wanna ruin my life lol,0,44
8387,i wanna see you reboot the fresh prince of belair bring back the original cast and everything amp do nothing that will ruin the show,0,132
8388,you can only make yourself happy fuck those tryna ruin it keep smiling,0,70
8389,there are a few people id let ruin my life my soul my cervix my everything odell is definitely top of that list,0,111
8390,ill ruin my life if i have to,0,29
8391,babe im gonna ruin you if you let me stay,0,41
8392,everything must be ok because shes listening to sandstorm now,0,61
8393,watch this airport get swallowed up by a sandstorm in under a minute,1,68
8394,watch this airport get swallowed up by a sandstorm in under a minute,1,68
8396,it wouldnt turn into a sandstorm if riot gave a good answer  instead they gave dumb excuses at least new client is there,0,120
8397,watch this airport get swallowed up by a sandstorm in under a minute,1,68
8399,i liked a  video  darude  sandstorm,0,35
8400,watch this airport get swallowed up by a sandstorm in under a minute,1,68
8401,watch this airport get swallowed up by a sandstorm in under a minute,1,68
8402,watch this airport get swallowed up by a sandstorm in under a minute,1,68
8404,watch this airport get swallowed up by a sandstorm in under a minute,1,68
8405,watch this airport get swallowed up by a sandstorm in under a minute,1,68
8406,a sandstorm in jordan has coated the middle easts largest refugee camp in a layer of grit,1,89
8408,sandstorm woo hoo,1,17
8409,watch this airport get swallowed up by a sandstorm in under a minute,1,68
8410,watch this airport get swallowed up by a sandstorm in under a minute,1,68
8411,watch this airport get swallowed up by a sandstorm in under a minute,1,68
8412,watch this airport get swallowed up by a sandstorm in under a minute,1,68
8414,who need friends when theres booze and darude  sandstorm d,0,58
8415,socialwots globiinclusion rt nrcmiddleeast sandstorm engulfs caravans and tents in the zaatari refugee camp,1,107
8416,watch this airport get swallowed up by a sandstorm in under a minute,1,68
8418,watch this airport get swallowed up by a sandstorm in under a minute,1,68
8419,watch this airport get swallowed up by a sandstorm in under a minute,1,68
8422,watch this airport get swallowed up by a sandstorm in under a minute,1,68
8423,watch this airport get swallowed up by a sandstorm in under a minute,1,68
8425,two hours of sandstorm remixes all merged together no betweensong silence,0,73
8428,watch this airport get swallowed up by a sandstorm in under a minute,1,68
8429,watch this airport get swallowed up by a sandstorm in under a minute,1,68
8430,put sandstorm down,0,18
8431,watch this airport get swallowed up by a sandstorm in under a minute,1,68
8432,watch this airport get swallowed up by a sandstorm in under a minute,1,68
8433,watch this airport get swallowed up by a sandstorm in under a minute,1,68
8434,come out to sandstorm tryouts aug 15th at lower woodland ms tryout 3430pm hs tryout 4306pm,1,90
8435,watch this airport get swallowed up by a sandstorm in under a minute,1,68
8436,is it darude sandstorm,0,22
8437,i cant listen to darude sandstorm without expecting airhorns now,0,64
8440,now playing darude  sandstorm  radio edit,0,41
8441,watch this airport get swallowed up by a sandstorm in under a minute,1,68
8443,i slammed my phone to the ground and then screamed ahahahga,0,59
8444,i just screamed to the world how much i love my little pony,0,59
8445,update the police seemed like nice enough people i felt bad when i transformed and they screamed dont worry theyre only unconscious,0,131
8446,someones gonna get screamed at for getting the lyrics wrong lmao,0,64
8447,i just screamed sidjsjdjekdjskdjd  i cant stand you,0,51
8448,of lokis daggers she pulled it out and jammed it into minas thigh when mina screamed and grabbed at her leg sif,1,111
8450,omfg didnt expect drag me down to be the first song pandora played   omfg i screamed so loud my coworker is scared,1,114
8451,she screamed when she got the microchip needle tbh i would have cried too the needle was massive ya haram,0,105
8452,i heard the steven universe theme song from upstairs and screamed his name at the part of the song and scared my cousin,0,119
8453,i screamed after hitting tweet,0,30
8454,the girls next to me screamed what the fuck is a chonce im cryibg,0,65
8455,i thought the loudest goal i ever screamed was higuains offside goal against germany,0,84
8457,i ran with earbuds in which i now realize means i probably didnt politely say hi to jared but more or less screamed at him,0,122
8458,i just got screamed at for asking my dad to move half a step so i could get through,0,83
8459,i dead ass screamed when we signed him i couldnt fucking believe it,0,67
8461,dont stop believing just came on the radio at this restaurant and a lil white bit screamed its mommys song,0,106
8463,brooke just face timed me at the concert and just screamed for 2 minutes straight,0,81
8464,wants to make tweet about how much i dislike todays femnism movement but doesnt want to be screamed at,0,102
8468,26 people have screamed right in my ear this week at camp twentysix and we still have 12 day left cedarglade2015,0,112
8471,some kids going to leadership camp came into my work today asking for the bathroom and my inner asb kid screamed a lot i miss camp,0,130
8472,vacation update my great aunt just killed a spider with her bare hand after i screamed in fear fierce,1,101
8473,not because i want to cheat or anything just feels good to vent to my twitter without a txt being screamed at lol,0,113
8475,im sorry im so wild in 1d shows like in my wwa show niall started singing steal my girl i literally screamed shut the fuck up,0,125
8476,i just screamed in 57 languages this is so good,0,47
8477,i screamed at the end oamsgajagahahah im laighign otrametlife,0,61
8478,i have never screamed so loud,0,29
8480,i screamed whats a chonce,0,25
8483,i screamed at the top of my lungs when you said you guys would come back to sa so keep your promise  addtexastonext1dtour,0,121
8484,why you screamed,0,16
8486,i literally walked out of the concert and screamed my soul has been blessed,0,75
8487,i just screamed what the fuck is a hond,0,39
8489,i just screamed,1,15
8490,kinda screamed gtlt,0,19
8491,i dont even remember slsp happening i just remember being like wtf and then the lights turned off and everyone screamed for the encore,0,134
8494,love waking up to my dad screaming at me,0,40
8496,if you are quiet enough you can literally hear the phandom screaming at the tyler tweet,0,87
8497,im screaming and fangirling oh my god,0,37
8498,during drag me down last night i was screaming shell of a mannequin instead of shell of a man and i think everyone hated me there,0,129
8500,internally and externally screaming,1,35
8502,cue the jariana stans screaming,0,31
8503,screaming,0,9
8504,now im internally screaming,0,27
8505,the first time i went swiming in it i was basically screaming why does it smelltaste so bad,0,91
8506,screaming,0,9
8507,lhh silent screaming was mastered,0,33
8508,hes hot amp he can sing im screaming,0,36
8509,its fine baby i was screaming at the tv x,0,41
8510,harshness follows us a better day by sarah c racing thoughts with screaming sirens pacing back and forth for,0,108
8511,my favs im screaming so fucking loud,0,36
8512,im screaming,0,12
8513,screaming,0,9
8514,camilas doing a follow spree tonight im screaming of happiness,0,62
8515,sorry for screaming at you and  from the car i just kinda i know those people lets yell,0,87
8516,my dad a screaming coach always gave his vocal chords quite the workout on the field  funnydadcoach,0,99
8517,54 9 how do people not know who kendall jenner is she has 6 times the instagram followers of gd screaming lmao,0,110
8518,and if she had a screaming baby you would have loved that so much more,0,70
8520,im screaming omg idols 22days wdym,0,34
8522,can you hear me screaming,0,25
8523,fucking screaming,0,17
8524,all the loves be screaming at this one,0,38
8526,hey there lonely girl did you have to tell your friends about the way i got you screaming my name,0,97
8528,nochilllukehammings im screaming,1,32
8530,if you follow me i will go into town and advertise your youtube channel by screaming and walking around with a sign pls,0,119
8531,screaming,0,9
8533,im screaming hes my favourite,0,29
8536,im screaming,0,12
8538,screaming in 22 different languages,0,35
8539,i am screaming hell yes ahhhh omg,0,33
8540,like little boy you better sit your ass down stop screaming at my mother stop pulling your hair amp crying like a 3 year old amp grow tf up,0,139
8541,omgggg im screaming,0,19
8542,ooooohshit ooohshit screams hell i love,0,39
8543,screams 666,0,11
8545,screams in the distance,1,23
8546,when you on the phone and  screams jaileens caked up on the phone so everyone looks at you,0,90
8547,screams in 25 different languages,0,33
8550,screams internally,0,18
8551,screams,0,7
8553,im going to ram your ass so hard ill have to shove your face on the pillows to muffle your screams of pain and pleasure,0,119
8555,i come downstairs trying to look as normal as possible in front of my mom and rhiannon screams hungover huh uhmmmm no,0,117
8556,he hit a tailor fucking made double play and kay screams he was robbed of a hit,0,79
8557,apparently my face screams  get me emotionally attached and then cheat on me,0,76
8558,screamsdont scare me and its animatronics,0,41
8559,gets on battlefield 3 screams into mic at cunts,0,47
8560,still echoes of their screams,0,29
8561,in every bts song jimin screams,0,31
8562,casually on the phone with jasmine while she cries and screams about a spider,0,77
8567,screams,0,7
8570,is the update rly life now is it is itscreams  vibrates i cant handle,0,69
8571,screams and gets a face full of saku genitals,0,45
8572,im not home i need to watch screams,0,35
8574,in light of recent events all i would like to say is screams for five years,0,75
8575,so  just followed me and i cannot contain my screams of joy thankyou,0,68
8576,my dell tablet screams with win10,0,33
8577,i do feel sorry for him he is not a piece of meat he is a nice guy people dont need to rush him and screams in his face,1,119
8578,i agree with certain cultural appropriation things but honestly if u looked at my house it screams appropriation bc buddhas and stuff,1,133
8579,this looney tunesblake griffin commercial screams their making a space jam 2,0,76
8580,screams where is everyone  oh wait school  ok  im ok,0,52
8581,aw man apollo crews just screams we cant think of a name for this black guy quick name some and mash them together,0,114
8582,go to sleep before someone screams at us,0,40
8584,when you go to a concert and someone screams in your ear does it look like i wanna loose my hearing anytime soon,1,112
8585,amp obama supports  death2usa,0,29
8586,the little girl next to me sees the spot lights in the sky and screams  mom look i see angels in the sky,1,104
8587,aaaa ok lemme move to another roomr so no one hears my gay ass screams,0,70
8589,screams,0,7
8591,screams at my own mother,0,24
8595,oil and gas exploration,1,23
8596,man is reading a list of famous musicians who oppose nuclear powerwow powerful evidence they must know a lot about seismic risks,0,128
8598,seismic risk a comparison between 2 case studies calabria and malta,1,67
8599,u better learn derivative of formula seismic rather than thinking about things like that or you are a things like that haha,0,123
8606,exploration takes seismic shift in gabon to somalia,1,51
8607,29 of oil and gas organizations have no realtime insight on cyber threats see how ey can help,0,93
8608,exploration takes seismic shift in gabon to somalia  worldoil subscription   somalia,0,84
8609,the 08062015 alabamaquake seismic summary w earthquake news amp history,1,71
8610,seismic apple tv service to stream 25 channels across all d,0,59
8612,zar cringes at the blows but doesnt let marek go he uses seismic toss,0,69
8613,seismic audio sa15t sa15t padded black speaker covers 2  qty of 1  1 pair,0,73
8615,sismo detectado japn report 1 010156 okinawa island region m40 depth 10km maximum seismic intensity 3 jst,1,105
8618,on the use of perforated metal shear panel sfor seismicresistant applications,0,77
8620,report 5 182245 ibaraki prefecture offing m55 depth 60km maximum seismic intensity 4 earthquake,1,95
8621,thanks benson amp clegg for the follow check out our maps at,0,60
8622,on thursday at 0025 we updated our kml of 2d and 3d seismic exploration vessels offshore oil,0,92
8623,oil and gas exploration takes seismic shift in gabon to somalia  bloomberg   somalia,1,84
8624,u control the future of india yor subject exploration or seismic maintenance electrical or mechanical,0,101
8625,sismo detectado japn report 3 010217 okinawa island region m38 depth 10km maximum seismic intensity 3 jst,1,105
8627,agency seeks comments on seismic permits,0,40
8628,still no plans dont worry we got you covered plenty of seismic ipa and seismic squeeze radler to help,0,101
8631,oilandgas exploration takes seismic shift in gabon to somalia  via,1,66
8633,exploration takes seismic shift in gabon to somalia,1,51
8635,new post from  3 major challenges of channel sales enablement,0,61
8636,panoramic resources cuts jobs after seismic event,1,49
8637,england east coast dogger bank westward 1 seismic survey in progress by mv western regent towing a 8400 metre long cable within area,0,132
8638,a subcontractor working for french seismic survey group cgg has been kidnapped in cairo and is held by islamic state the company said on w,1,138
8639,the art worlds seismic shift back to the oddball  observer,0,58
8640,sismo detectado japn 063243 miyagi estimated seismic intensity 0 jst,1,68
8642,sinkhole selfies you wont believe whats in the brooklyn sinkhole          sinkhole selfies you wont belie,0,105
8643,mrw when a sinkhole opens up beneath my friends and i gif funny lol comedy ifunny video image rt,1,96
8644,talk on goz is fantastic most interesting fact so far is that they manually bought all the ru domains to sinkhole rather than seek coop,0,135
8646,nothing surprises me anymore and i am sure there is more to come,0,64
8647,large sinkhole swallows entire pond in lowndes county georgia large sinkhole  occasion2b,1,88
8648,10news  water main break disrupts trolley service,1,49
8650,sinkhole closes falmer drive in bethlehem township,1,50
8651,a sinkhole grows in brooklyn sixmeter crater swallows street,1,60
8653,screaming mad scientist deceased after tumbling over heels and falling into sinkhole during investigation,0,105
8654,gaping sinkhole opens up in brooklyn new york,1,45
8655,this morning fdny responded to a sinkhole in brooklyn units remain onscene with  amp others,1,91
8656,150foot sinkhole opens in lowndes county residential area wctv35 minutes ago,1,76
8657,large sinkhole swallows entire pond in lowndes county georgia  yonews,1,69
