id,clean_text,target,text_length
2547,motorcyclist bicyclist injured in denver collision on broadway  by,1,66
2548,south sac i5 s  i5 s 43rd ave ofr trfc collisionno inj,1,54
2550,anti collision rear gadget technology,0,37
2552,sometimes in space celestial bodies with separate trajectories that intertwine find themselves in a dance rather than a collision course,0,136
2553,the next financial crash the writing is on the wall dont say you werent warned  via,0,83
2554,i feel that crash and burn by thomas rhett for sure,0,51
2555,motogp indianapolis espargaro layout worries me a little,0,56
2556,just bought another  18 medium crash hey  what about an endorsement starting to get expensive,0,93
2557,html5 beginners crash course  course,1,36
2559,a slamming door and a lesson learned i let another lover crash and burn,0,71
2560,who had a car crashsterlingwho was driving in the carmel or joeysterling knight,0,79
2561,alright now im gonna crash im so exhausted,0,42
2564,party for bestival crash victim michael molloy on what would have been his 21st,1,79
2565,cleared crash in hamilton on i75 south at mm 459,1,48
2566,deliver value a cash source crash course  course,1,48
2568,the next financial crash the writing is on the wall dont say you werent warned,0,78
2569,am boy,0,6
2570,make man pikin crash,1,20
2571,incident crash in pascoe vale south outbound on tullamarine fwy citylink near moreland rd vehicles off in emergency lane no delays,1,130
2572,i let another love crash and burn,0,33
2573,if you sit and rant on snapchat to your apparent fans when you have about 8000 followers i hope your in a train crash xoxo,0,122
2575,crash and burn,1,14
2576,cpanel crash course  course,0,27
2579,getting kicked out by that crash is one of the worst experiences ive had playing video games,0,92
2582,ill crash it,1,12
2585,please keep josh the salyersblairhall families amp jennas friends in your prayers she was taken far too soon rip,0,112
2587,one night and were gonna come and crash the party werent invited but were feelin so,0,83
2588,fatal crash reported on johns island,1,36
2590,photoshop tools crash course  complete photoshop tool guide  course,0,67
2591,photoshop cs6 crash course  course,0,34
2592,kinetic typography crash course after effects video  course,0,59
2593,police respond to crash find suspected heroin,1,45
2594,i see dat we liable to fuck up and crash,0,40
2597,akilah world news cop pulls man from car to avoid this,1,54
2598,man killed in crash in barrington hills a hoffman estates man was killed in a singlecar crash wednesday afte,1,108
2599,crash helmet silvery floors karnal fat shoot sampling 33 pbcanpcx,0,65
2602,crash test trailer paul scheer amp rob huebels comedy special recorded on a,0,75
2603,i tried downloading it and it crashed after the tutorial,0,56
2604,maj muzzamil pilot offr of mi17 crashed near mansehra today,1,59
2605,bin laden family plane crashed after avoiding microlight and landi  peritoengrafoscopia,1,87
2606,my son didnt sleep all night  so finally at 4am i laid him with me on my bed and he crashed out,0,95
2608,neileastwood77 i am a knobhead bin laden family plane crashed after avoiding microlight and landing t,1,101
2609,bin laden family plane crashed after avoiding microlight and landing too far down runway three members of t,1,107
2611,ux fail of emv  people want to insert and remove quickly like a gas pump stripe reader 1 person told me it crashed the pos,1,122
2612,major hamayun shaheed pilot of mi7 heli that crashed in mansehra,1,64
2614,uk bin laden family plane crashed after avoiding microlight and landing too far down runway three members,1,105
2616,it has crashed so many times the past couple hours,0,50
2617,gt bin laden family plane crashed after avoiding microlight and landing too far down runway  rochdale heywood,1,109
2619,my ipod crashed  weloveyoulouis  mtvhottest one direction,1,57
2621,heard this few days ago while driving and near crashed the car from laughing to much,0,84
2622,havnt you crashed,0,17
2624,could anyone tell me of this here has crashed or just taking a very long time windows10 please,0,94
2625,intactmh370partliftsoddsplaneglidednotcrashedintosea  via hope for answers,1,74
2627,pak army helicopter crashed in mansehra,1,39
2628,1  the bug that almost crashed the euro,1,39
2629,pakistan says army helicopter has crashed in countrys restive northwest killing at least 8,1,90
2631,news bin laden family plane crashed after avoiding microlight and landing too far down runway,1,93
2632,this guy bought my car on tuesday police knocked my door yday cos he crashed n ran amp 2day he text me asking not to send the log book,1,134
2633,maj muzzamil pilot offr of mi17 crashed near mansehra today may almighty give strength to family to bear the loss,1,113
2635,thief broke front window of hicksville store stole 50 cell phones fled crashed into,0,83
2637,army sources say 12 persons on board including a team of doctors die in helicopter crashed near mansehra weather seems to be cause of crash,1,139
2640,skype just crashed u host,0,25
2641,i already had my phone updated to 84 and somehow my phone crashed and i had to restore it and theyre not letting me restore it,0,126
2642,he was only 4 of a second faster than me and i overtook him twice then crashed tru luv lt3 lt3,0,94
2643,i just nearly crashed my car typing paul rudd attacked by flying ants into notes on my phone,0,92
2644,honestly nightmarish god driving to new places is always stressful as shit amp i hate it so much ugh almost crashed a few times,0,127
2645,i crashed my car into a parked car the other day modestmouseremix truestory,0,75
2647,f496d mhtw4fnet  pakistan says army helicopter has crashed in countrys restive northwest   fox news,1,99
2648,ttw todays news bin laden family plane crashed after avoiding microlight and landing too far down runway,1,104
2649,heard skh on the radio for the first time almost crashed the car,1,64
2651,mh370 intact part lifts odds plane glided not crashed into sea,1,62
2655,more like you love your husband but youre posting another man for your man crush mondays lol,0,92
2656,womem crush wednesday,0,21
2657,6  your bfgfcrush,1,17
2658,this guy idk just made me his woman crush  first one ever,0,57
2659,wce i cant even lie even tho i cant stand her she still will always be my crush,0,79
2660,women crush,0,11
2661,my woman crush wedneday goes to the beautiful  loveyouuuu aintsheperty,0,70
2663,being bestfriends with your high school crush,0,45
2664,ina buted girl crush,1,20
2666,samelsamel has a crush,0,22
2667,im my own woman crush,0,21
2668,love love love do you remember your first crush,0,47
2670,had a minute alone with my crushit was an overrated experiencesmh,0,65
2671,que crushmtvhottest justin bieber,0,33
2672,master0fsloths has a crush,0,26
2673,my lil brother has a crush on mariah,0,36
2675,ron amp fez  daves high school crush  via,1,41
2676,when youre girlfriend is completely gorgeous  woman crush amp stuff,0,67
2677,im so high moe im bouta crush this fridays,0,42
2679,i have the biggest crush on you amp i dont know if youll ever know it,0,69
2680,mrrobinson is giving me thesteveharveyshow vibe music teacher looks out for students has crush on girl he went to high school with,0,130
2682,seriously have the biggest girl crush ever on blake lively,0,58
2683,when you see your crush in the stands vine by,0,45
2684,yhngsjlg just tweeted about their secret crush,0,46
2687,yeah i have a crush on her,0,26
2688,me trying to look cute wen crush is passing by,0,46
2689,crush content marketingmediocrity,0,33
2691,only had a crush on one girl in high school and she dont even realize it lol,0,76
2692,sevenfigz has a crush,1,21
2693,men crush every fucking day,0,27
2694,tiffanyfrizzell has a crush,0,27
2695,more than a crush  wce,0,22
2696,lmao well i only know one and ive only had a crush on this one sooo,0,67
2698,nowplaying fitz and the tantrums  out of my league on crush listen  nowplaying,0,78
2700,man crush everyday,0,18
2701,do he love me do he love me not i aint a playa i just crush a lot,0,65
2702,kenny holland crush da vida,0,27
2703,crushed,0,7
2706,this popeyes bout to get crushed,0,32
2707,that was crushed holy shit,0,26
2708,bhavanas mom has crushed everyones soul,0,39
2709,crushed it,0,10
2711,wrapup 2us cable tv companies shares crushed after disney disappoints,0,69
2714,i crushed squirrel bones with a mortar and pestle for my schools bio dept not really sure why worstsummerjob,0,108
2715,edwin wow crushed,0,17
2719,mango juice with crushed icegtgtgtgt,0,36
2720,man crushed to death by own car,1,31
2723,a diamond is just a piece of charcoal that handled stress exceptionally well we are hard pressed on every side but not crushed2 cor48,1,133
2724,wow he crushed that edwing bluejays,0,35
2725,crushed the gym then crushed a butterfinger flurry clearly my priorities are straight,0,85
2726,wrapup 2us cable tv companies shares crushed after disney disappoints,0,69
2727,so the question is would you crush ortiz for bunting as your sports writing forefathers crushed williams,0,104
2728,ouch clelliyou could almost hear their hopes and dreams being crushed,0,69
2729,jesus christ that ball was fucking crushed bluejays,0,51
2730,i crushed a 31 km run with a pace of 541 with nike sportwatch gps nikeplus,0,74
2731,papi absolutely crushed that ball,0,33
2732,crushed a 6 mile run tonight awesome,0,36
2733,wrapup 2us cable tv companies shares crushed after disney disappoints,0,69
2734,oil prices falling but drivers could reap benefits,0,50
2736,i crushed a 112 km run with a pace of 746 with nike sportwatch gps nikeplus,0,75
2739,nick williams just hit another bomb just crushed it,0,51
2740,holy moly that was crushed,1,26
2741,ayekoradio play brasswork agency  crushed and shaken  radio netlabel electronicmusic listen ccmusic,0,99
2743,so many youtube commenters saying the dothraki would get crushed if they came to westerosnah bro you underestimate the dothraki,1,127
2744,disillusioned lead character  check happy go lucky free spirit girl check dream life crushed check great music check all crowe tropes intact,0,140
2748,remember how nora jones crushed it in two weeks notice,0,54
2749,how empire avenue crushed my soul  via,0,38
2752,13 m chapoutier crozes hermitage so much purple violets slate crushed gravel white pepper yum france wine dc,0,108
2753,the thirst has no curfew,0,24
2755,ara news reporting jan fighters infiltrated ashrafiyah district of afrin with aim of carrying out suicide attacks ypg have imposed a curfew,1,139
2756,thirst has no curfew,0,20
2757,and the fact that i have a curfew,0,33
2758,shut up freshman its past ur curfew u need some sleep u spend too much of ur time watching tv instead of going outside,0,118
2759,is there a night curfew on campus  find out here,0,48
2760,police teenagers arrested for curfew violations in evanston were riding stolen bicycles two teenagers taken into cus  chicago news,1,130
2761,for some reason im listening to curfew overtime and stuck in a kodak over and over again,0,88
2763,i shouldve gave him a curfew,0,28
2765,curfew really helps if you think about it  bc,0,45
2766,exofficio mens boxer brief curfew large,0,39
2767,info s wnd 0306 cld sct014 bkn032 exp inst apch rwy 05 curfew in oper until 2030 z taxiways foxtrot 5 amp foxtrot 6 navbl tmp 10,0,128
2768,thank you  now i dont have a city wide curfew,0,45
2769,she just said does he have a curfew nope,0,40
2770,her curfew will start right after her private class ends tutor must a woman preferably someone over 50,0,102
2771,there is no such curfew,0,23
2773,it was past curfew and we were at the grove,0,43
2774,because its 12 oclock and my mom said everyone has to go home because of curfew,1,79
2777,she said a few months but i get a curfew for out time smfh,0,58
2778,ball has no curfew,0,18
2780,i be seen them turn a blind eye to a bloke drinking and smoking on during the curfew time cosits not worth the hassle,1,117
2782,next may ill be freefrom school from obligations like family best of all that damn curfew,1,89
2783,i know  will be saying her final goodbyes to grandpa as seen on news rip me always open to ideas but may ve curfew,0,114
2784,people really still be having curfew even when theyre 18 amp graduated high school,0,82
2785,im telling your mom your up past curfew oth,0,43
2786,had to cancel my cats doctor appointment because she decided to go out and play and not come home by curfew,0,107
2787,info r curfew in oper until 2030 z taxiways foxtrot 5 amp foxtrot 6 navbl wnd 0605 exp inst apch rwy 05 damp tmp 10 qnh 1028,0,124
2788,but no lies though its pays to be the oldest sometimes like being the first to get a car and have no curfew freedom donthate,0,124
2792,info u cld sct012 bkn025 exp inst apch rwy 05 curfew in oper until 2030 z taxiways foxtrot 5 amp foxtrot 6 navbl tmp 10 wnd 0306,0,128
2793,rite now man a tlk widout nuh curfew long side aka cum fi steal di show itz a rubbery di whole a dem fi knw sound it music,0,122
2794,dont even come if you worried about curfew bc19,0,47
2795,you got a whole curfew,0,22
2796,when youre 5 hours late for curfew and have to pray your dog doesnt bark when unlocking the door,0,96
2797,da judge gave dis girl 5pm curfew,0,33
2799,in the beginning of summer my mom made my curfew 1 now its back to 12 and i can never go out and she wonders why im always at home,0,130
2801,why charlie lim start at 9pm on this sunday i have curfew leh,0,61
2802,when u bombed and u try 2 get home for curfew,0,45
2803,a baby walter rewatchingthepilot teamscorpion cyclone,0,53
2807,the big ten has their annual football media day but before we get into that heres some cyclone hoops recruiting nuggets,1,119
2808,camera art photography  0215 new boltcyclone dr pp400dr dual outlet power packfor external camera flash  30,0,107
2811,it works for my purpose a large cyclone would be better i just dont have 4k this was 500,0,88
2813,a new tropical cyclone is forming near guam  once it is formed it will be called molave,1,87
2815,video new de jhaustin thomas on being a cyclone  ames tribune ames tribune video new de jhaustin thomas on,0,106
2817,we need these plants in the pacific during the cyclone seasons it would help,1,76
2819,bbc forced to retract false claims about cyclone pam  via,1,57
2820,great condition easton cyclone softball bat fastpitch 9 2920 sk398,1,66
2821,severe weather bulletin no 5 for typhoon hannaph soudelor tropical cyclone warning  issued at 500 pm 06,1,103
2822,the cyclone derives its powers from a calm center so does a person  norman vincent peale,1,88
2825,ante hudhud cyclone chandrababu valle ne ante ga,1,48
2826,cyclone komen devastates families in myanmar this week we need to help them today,1,81
2827,severe weather bulletin 6 tropical cyclone warning typhoon hanna  issued at 1100 pm thursday 06 august,1,102
2828,back to the future in vanuatu how cyclone pam has encouraged traditional ways of living,1,87
2829,bank manager asks tom in an interview what is cyclone tom it is the loan given to purchase a bicycle,0,100
2830,excited for cyclone football,0,28
2831,bbc forced to retract false claims about cyclone pam  via,1,57
2832,talent misdirection cyclone pass ignite pass vanishing drive phantom shot  kurokobot,1,84
2833,now on comdev asia radio stations in bangladesh broadcasting programs to address the upcoming cyclone komen,1,107
2835,like a cyclone imperialism spins across the globe militarism crushes peoples and sucks their blood like a,1,105
2836,1970 mercury cyclone gt hood moulding very nice core cobra jet 429cj gt,0,71
2838,im a cyclone passion overblown,0,30
2839,his majesty emperor salman khans unstoppable cyclone of entertainment humanity bajrangi bhaijaan creating history everywhere  crosed 300 cr,0,139
2841,1970 mercury cyclone gt quarter panel ds rear trim moulding cobra jet 429cj,1,75
2842,tropical cyclone info soudelor 945hpa maximum wind speed 45ms maximum wind gust speed 60ms,1,90
2843,if i may ask cyclonesama have you read jailed fate by rindou,0,60
2844,some drugs and alcohol in jackson vroman house,0,46
2846,blending the old with the new in vanuatu to prepare for future emergencies,0,74
2849,wfp  wfp delivers food to 165000 bangladesh flood victims after tropical cyclone komen dhaka the united na,1,106
2851,rohingya houses in kyee nockthie hamlet from taungbazar region in buthidaung were severely damaged in cyclone,1,109
2852,cyclone by double g would be the cherry on top to this outfit ootd doubleghats,0,78
2853,theyll probably allow us to ascend them but not get them to the damage max values,0,81
2854,drop it down on a nigga do damage,0,33
2855,unions say they are supportive of london yet are prepared to damage it economically 300m last time,0,98
2856,i liked a  video  gta 5 online  collateral damage gta v online pc,0,65
2857,fyi accident property damage3460 limestone lncolyellowstone wayfieldstone dr08052015 193635,1,91
2858,fitness knee damage solution,0,28
2860,and here i was complaining about phoenix mode in fire emblem turns out ray gigant will have a difficulty option where you take 0 damage,0,135
2861,wha t is this kids damage,0,25
2863,cleared  accident with property damage on ny35 eb at ny 100,1,59
2864,its crazy how a phone can do so much damage to a person,0,55
2865,it got pretty windy here too but no damage,0,42
2866,reusing advanced in life equipments in transit to drumming champaign damage fdbdp,0,81
2867,but if you are carful about spotting damage  time of check in why not  time of giving away baggage its my loss all d wy,0,119
2869,storm damage reported in west tennessee,1,39
2870,hey the royals love doing damage with 2 outs,1,44
2871,you can keep this please arachys     2 pieces  now deals 4000 weapon damage up from 2500,1,88
2872,mages of fairy tail specialize in property damage  natsu dragneel,0,65
2873,yeah but being fast and doing extremely high damage is what its all about if you want fast then im gonna have to get u the,1,122
2875,the saw is fast af and does great damage i upgraded it a shitton and used it exclusively for a whole playthrough,0,112
2877,lets say a tree falls on your fence do you know how your homeowners insurance may help,0,86
2878,tor for a tor situation only wind damage enhanced wording is key imo,1,68
2879,what is happening we hear there is runway lighting damage by a contractor,1,73
2880,if the nda is written to damage your ability to offer your services in the future then you prolly dont want the work anyway,0,123
2881,if trillion crosses the line a 3rd time he does a fieldwide attack that does instant kill damage,1,96
2882,np metallica  damage inc,0,24
2883,nine inmates charged with causing damage in calgary remand centre riot,1,70
2884,pt crosssectarian protest powerful shia cleric says militias must withdrawur fightin isis but we wont forget damage uve done to ur ppl,1,134
2885,does homeowners insurance cover water damage here are some good things to know,1,78
2886,beach did damage to my shit,1,27
2887,crosses her arms to cover her hands from doing anymore damage hhello,0,68
2888,new post on my blog   thesensualeye  model cam damage  toronto apr 2014  nsfw pussy ass boobs asian nude,0,104
2889,reported hit amp runin roadwayproperty damage at 15901 statesville rd,1,69
2890,devil may cry 4 special edition vergil vs agnus window mission 6  dmd  no damage by leedstraif,0,94
2891,glaucoma occurs when fluid builds up pressure inside eye to a level that may damage optic nerve eyefacts,1,104
2893,jsunnews storm damage reported in madison county thunderstorm damage reports ar  via,1,84
2895,s61231a puncture wound without foreign body of left index finger without damage to nail initial encounter icd10,1,111
2896,thank you   for words of warning re queenswharf brisbane  via,0,61
2898,this real shit will damage a bitch,0,34
2899,lmao fuckboy changed his  for damage control,0,44
2900,standard damage control,1,23
2902,it said they had superficial wounds and it was the pepper spray that did the most damage,1,88
2905,dad i wont chase you constantly amp all the time but frequently with a great deal of danger and distraction lt3,0,111
2907,i believe there is a shirt company now for every animal that has ever been in danger i better start seeing some changes in wildlife,0,131
2908,danger of union bears,0,21
2909,the signup is open for the falling for danger release day blast and review tour signup here,1,91
2910,check out this rockin preview of  danger zone coming soon  artistsunited,0,72
2911,red flag warning for fire danger amp dry thunderstorms in bay area  weather cawx by,1,83
2912,check out this rockin preview of  danger zone coming soon  artistsunited,0,72
2913,what is this like i could be in danger or something,1,51
2915,when the last tree is cut down the last fish eaten and the last stream poisoned you will realize that you,0,105
2916,my take away preservation parks r an imposition amp a danger to african people i never imagined,0,95
2917,indian govt amp media should take serious concern about their safety they are in danger now,1,91
2920,training grains of wheat to bare gold in the august heat of their anger im the no trespass lest you seek danger,0,111
2921,fettilootch is slanglucci oppressions greatest danger coming soon the album,0,75
2922,it appears our govt has lost an ethical and or moral relevance this means the whole usa population is in danger from them,0,121
2924,dont like those head first slides especially into home  danger,0,62
2925,permits for bear hunting in danger of outnumbering actual bears the licenses for floridas fir  st petersburg,0,108
2927,and not too much danger please,0,30
2929,fettilootch is slanglucci oppressions greatest danger coming soon the album,1,75
2931,is looking to repair its recent bad rap with some nonprofit partnerships,0,72
2932,i wish i could get victorias secret on front im good for it,0,59
2933,check out this rockin preview of  danger zone coming soon  artistsunited,0,72
2934,why would arsenal fans want that west ham will be in a relegation battle this season no danger for afc on sun,0,109
2935,fettilootch is slanglucci oppressions greatest danger coming soon the album,0,75
2936,fettilootch is slanglucci oppressions greatest danger coming soon the album,0,75
2937,the danger and excitement of underwater cave diving,0,51
2939,the girl that i wanna save is like a danger to my health try being with somebody that wanna be somebody else,0,108
2941,guns are for protection  that shit really shouldnt be used unless your life in danger,0,85
2942,so thirsty yall in danger of dehydration,1,40
2943,thunderstorms with little rain expected in central california high fire danger weather cawx,1,91
2944,i wanna get a danger days tattoo so bad how cool would that spider look like on someones wrist or smth,0,102
2945,in my experience if youre always angry and critical as a pundit you are in grave danger of going off the rails 1,0,112
2946,i am not in danger skyler i am the danger,0,41
2947,too dangerous for them but its ok for the rest of us to be in danger,0,68
2948,investigate why robert mueller didnt respond to my complaints since nov 2011 amp just left meson out her in danger,0,114
2950,honestly tho modibo maiga is stealing a living  fuck all about him  im past my best but still more of a danger than that fucktard coyi,1,134
2952,fear has a way of making us see danger where there is none contemplating the logic behind the situation and find the courage to engage it,0,137
2953,joel 228 and book of acts 217,0,29
2954,17 dead as afghanistan aircraft crashes an afghan military helicopter has crashed in a remote region of the s,1,109
2955,why not even more awesome norse landscapes with loads of atmosphere and life than boringdead snotgreen wastelands,0,113
2956,i miss my longer hairbut it was so dead anyways it wasnt even hair,0,66
2957,4sake of argsuppose preborn has attained individl rightsgenerally courtof law forbids killing unless dead person did something,0,126
2959,remember that time goku gave life to a dead birb  what the hell goku,0,68
2960,naaa i bee dead like a legit zombie  i feel every sore part in my body,0,70
2963,we just happened to get on the same road right behind the buses im dead serious,0,79
2965,lmfao fucking luis hhahaha im dead,0,34
2969,i just watched emmerdale nd i dont know who most of them are but a slightly attractive man named ross just got beat up nd now hes dead,1,134
2970,i need you to confirm that ross is dead cause i dont trust anyone else yh,0,73
2971,iwasdisappointedby telltales the walking dead good characters ampstory but no real gameplay and too many performance issues,0,123
2973,beforeitsnews  hundreds feared dead after libyan migrant boat capsizes during rescue,1,84
2974,if its a war you came to see you will never see a waved white flag in front me i cant end up dead i wont be misled,0,114
2975,oh fuck sake he is dead,0,23
2976,is ross really dead askcharley,0,30
2980,don avoid wearing dead black flaming red and stark white so much and esp at debate go with your blue gold brown even to shoes and,0,129
2982,perspectives on the grateful dead critical writings contributions to the study,1,78
2983,hello im looking for mod cold ice i saw it on your site but link to download dead maybe you have it and share with me thanks,0,124
2984,lmaovv hard the ny is the the new trend babalmaowelcome to nyozi kwaaaaadead,0,76
2987,now ive said all this hes dead and no one else dies,0,51
2988,is ross dead noooooooooooo,0,26
2990,thinking of the time that my friend bailed the nite b4 a dead showwent alone amp had a great time all alone and free to dance front row,0,135
2991,typhoon soudelor taking dead aim at taiwan,1,42
2992,askcharley emmerdale how emotional are you that ross is dead  5,0,63
2993,man found dead in demi moores swimming pool,1,43
2995,thats it val is dead im suing,1,29
2998,he is dead,0,10
3000,wyrmwood road of the dead 2014 was fucking awesome and it had an awesome ending too awesome one,0,95
