id,clean_text,target,text_length
1,our deeds are the reason of this earthquake may allah forgive us all,1,68
4,forest fire near la ronge sask canada,1,37
5,all residents asked to shelter in place are being notified by officers no other evacuation or shelter in place orders are expected,1,130
6,13000 people receive wildfires evacuation orders in california,1,62
7,just got sent this photo from ruby alaska as smoke from wildfires pours into a school,1,85
8,rockyfire update  california hwy 20 closed in both directions due to lake county fire  cafire wildfires,1,103
10,flood disaster heavy rain causes flash flooding of streets in manitou colorado springs areas,1,92
13,im on top of the hill and i can see a fire in the woods,1,55
14,theres an emergency evacuation happening now in the building across the street,1,78
15,im afraid that the tornado is coming to our area,1,48
16,three people died from the heat wave so far,1,43
17,haha south tampa is getting flooded hah wait a second i live in south tampa what am i gonna do what am i gonna do fvck flooding,1,127
18,raining flooding florida tampabay tampa 18 or 19 days ive lost count,1,68
19,flood in bago myanmar we arrived bago,1,37
20,damage to school bus on 80 in multi car crash breaking,1,54
23,whats up man,0,12
24,i love fruits,0,13
25,summer is lovely,0,16
26,my car is so fast,0,17
28,what a goooooooaaaaaal,0,22
31,this is ridiculous,0,18
32,london is cool,0,14
33,love skiing,0,11
34,what a wonderful day,0,20
36,looooool,0,8
37,no wayi cant eat that shit,0,26
38,was in nyc last week,0,20
39,love my girlfriend,0,18
40,cooool,0,6
41,do you like pasta,0,17
44,the end,0,7
48,wholesale markets ablaze,1,24
49,we always try to bring the heavy metal rt,0,41
50,africanbaze breaking newsnigeria flag set ablaze in aba,1,55
52,crying out for more set me ablaze,0,33
53,on plus side look at the sky last night it was ablaze,0,53
54,mufc theyve built so much hype around new acquisitions but i doubt they will set the epl ablaze this season,0,107
55,inec office in abia set ablaze,1,30
56,barbados bridgetown jamaica  two cars set ablaze santa cruz  head of the st elizabeth police superintende,1,105
57,ablaze for you lord d,0,21
59,check these out     nsfw,0,24
61,on the outside youre ablaze and alive but youre dead inside,0,59
62,had an awesome time visiting the cfc head office the ancop site and ablaze thanks to tita vida for taking care of us,0,116
63,soooo pumped for ablaze,0,23
64,i wanted to set chicago ablaze with my preaching but not my hotel,0,65
65,i gained 3 followers in the last week you know your stats and grow with,0,71
66,how the west was burned thousands of wildfires ablaze in california alone,1,73
67,building the perfect tracklist to life leave the streets ablaze,0,63
68,check these out     nsfw,0,24
71,first night with retainers in its quite weird better get used to it i have to wear them every single night for the next year at least,0,133
73,deputies man shot before brighton home set ablaze,1,49
74,man wife get six years jail for setting ablaze niece,1,52
76,santa cruz  head of the st elizabeth police superintendent lanford salmon has r,0,79
77,police arsonist deliberately set black church in north carolinaablaze,1,69
78,noches elbestia  happy to see my teammates and training hard  goodnight gunners,0,79
79,kurds trampling on turkmen flag later set it ablaze while others vandalized offices of turkmen front in diyala,1,110
80,truck ablaze  r21 voortrekker ave outside or tambo intl cargo section,1,69
81,set our hearts ablaze and every city was a gift and every skyline was like a kiss upon the lips,0,95
82,they sky was ablaze tonight in los angeles im expecting ig and fb to be filled with sunset shots if i know my peeps,0,115
83,how the west was burned thousands of wildfires ablaze in california alone  climate energy,1,89
85,revel in yours wmv videos by means of mac farewell ablaze wmv en route to dvd gtxrwm,0,84
86,progressive greetings  in about a month students would have set their pens ablaze in the torch publications,0,107
89,rene ablaze amp jacinta  secret 2k13 fallen skies edit  mar 30 2013,0,67
91,steve these fires out here are something else california is a tinderbox  and this clown was setting my hood ablaze,1,114
92,nowplaying rene ablaze amp ian buff  magnitude   edm,0,52
93,huge fire at wholesale markets ablaze,1,37
95,what time does your talk go until i dont know if i can make it due to work,0,74
96,i cant have kids cuz i got in a bicycle accident amp split my testicles its impossible for me to have kids michael you are the father,0,133
97,accident on i24 w nashvilletraffic traffic moving 8m slower than usual,1,70
98,accident center lane blocked in santaclara on us101 nb before great america pkwy bayarea traffic,1,96
100,had a personalinjury accident this summer read our advice amp see how a solicitor can help otleyhour,0,100
102,stlouis caraccidentlawyer speeding among top causes of teen accidents   car accident tee,0,88
104,reported motor vehicle accident in curry on herman rd near stephenson involving an overturned vehicle please use,1,112
105,bigrigradio live accident awareness,1,35
107,i77 mile marker 31 south mooresville  iredell vehicle accident ramp closed at 86 118 pm,1,87
109,rt  sleeping pills double your risk of a car accident,0,53
110,by accident they knew what was gon happen,0,41
112,traffic accident n cabrillo hwymagellan av mir 080615 110358,1,60
113,i77 mile marker 31 to 40 south mooresville  iredell vehicle accident congestion at 86 118 pm,1,92
114,the pastor was not in the scene of the accidentwho was the owner of the range rover,1,83
117,mom we didnt get home as fast as we wished  me why is that mom there was an accident and some truck spilt mayonnaise all over,0,125
118,i was in a horrible car accident this past sunday im finally able to get around thank you god,1,93
119,can wait to see how pissed donnie is when i tell him i was in another accident,0,78
120,truckcrash overturns on fortworth interstate  click here if youve been in a crashgt,1,83
121,accident in ashville on us 23 sb before sr 752 traffic,1,54
126,carolina accident motorcyclist dies in i540 crash with car that crossed median a motorcycle rider traveling,1,107
128,fyi cadfyi accident property damagenhs999 piner rdhorndale dr,1,61
129,rt naayf first accident in years turning onto chandanee magu from near mma taxi rammed into me while i was halfway turned everyone conf,1,135
130,accident left lane blocked in manchester on rt 293 nb before eddy rd stop and go traffic back to nh3a delay of 4 mins traffic,1,125
131,accident property damage piner rdhorndale dr,1,44
132,it was an accident,0,18
133,fyi cadfyi accident property damagewpd1600 s 17th st,1,52
134,86201509 pm traffic accident no injury at 2781 willis foreman rd,1,64
135,aashiqui actress anu aggarwal on her nearfatal accident,1,55
136,suffield alberta accident,1,25
137,9 mile backup on i77 southaccident blocking the right 2 lanes at exit 31 langtree rdconsider nc 115 or nc 150 to nc 16 as alternate,1,131
138,has an accident changed your life we will help you determine options that can financially support life care plans and ongoing treatment,0,135
139,breaking there was a deadly motorcycle car accident that happened to hagerstown today ill have more details at 5  whag,1,118
141,were you marinading it or was it an accident,0,44
143,only had a car for not even a week and got in a fucking car accident  mfs cant fucking drive,1,92
144,bahrain police had previously died in a road accident they were not killed by explosion,1,87
145,i still have not heard church leaders of kenya coming forward to comment on the accident issue and disciplinary measuresarrestpastornganga,0,138
146,scuf ps live and the game cya,0,29
149,the man who can drive himself further once the effort gets painful is the man who will win  roger bannister,0,107
151,320 ir icemoon aftershock      dubstep trapmusic dnb edm dance ices,0,67
153,there is no victory at bargain basement prices dwight david eisenhower,0,70
156,320 ir icemoon aftershock      dubstep trapmusic dnb edm dance ices,0,67
157,nobody remembers who came in second charles schulz,0,50
158,im speaking from someone that is using a scuf on xb1 most of them people will end up getting on for ps also,0,107
159,the harder the conflict the more glorious the triumph thomas paine,0,66
160,growingupspoiled going clay pigeon shooting and crying because of the aftershock,0,80
161,so i guess no one actually wants any free aftershock tc,0,55
162,aftershock was the most terrifying best roller coaster ive ever been on disclaimer ive been on very few,0,103
163,aftershock,0,10
164,320 ir icemoon aftershock      dubstep trapmusic dnb edm dance ices,0,67
165,320 ir icemoon aftershock      dubstep trapmusic dnb edm dance ices,0,67
168,320 ir icemoon aftershock      dubstep trapmusic dnb edm dance ices,0,67
170,im seeing them and issues at aftershock,0,39
171,320 ir icemoon aftershock      dubstep trapmusic dnb edm dance ices,0,67
172,320 ir icemoon aftershock      dubstep trapmusic dnb edm dance ices,0,67
173,wisdomwed bonus  5 minute daily habits that could really improve your life how many do you already do lifehacks,0,111
174,aftershock protect yourself and profit in the next global financial meltdown by david wiedemer http,0,99
175,that moment when you get on a scary roller coaster and the guy behind you is just screaming bloody murder  silverwood aftershock,0,128
176,aftershock  2010 full streaming  youtube,0,40
178,gtgt 15 aftershock  protect yourself and profit in the next global financial book,0,81
180,sometimes you face difficulties not because youre doing something wrong but because youre doing something right  joel osteen,0,124
182,the only thing that stands between you and your dream is the will to try and the belief that it is actually possible  joel brown,0,128
183,praise god that we have ministry that tells it like it is now wdyouth biblestudy,0,80
184,remembering that you are going to die is the best way i know to avoid the trap of thinking you have something to lose  steve jobs,0,129
185,tried orange aftershock today my life will never be the same,0,60
187,i love you bb,0,13
190,aftershock,0,10
191,aftershock back to school kick off was great i want to thank everyone for making it possible what a great night,0,111
193,people who say it cannot be done should not interrupt those who are doing it  george bernard shaw,0,97
194,the first man gets the oyster the second man gets the shell andrew carnegie,0,75
195,anyone need a pu tonight i play hybrid slayer ps4 eu hmu,0,56
196,experts in france begin examining airplane debris found on reunion island french air accident experts o  news,1,109
197,strict liability in the context of an airplane accident pilot error is a common component of most aviation cr,1,109
198,your lifetime odds of dying from an airplane accident are 1 in 8015,0,67
199,experts in france begin examining airplane debris found on reunion island french air accident experts on wedn,1,109
201,a theyre on an airplane accident and theyre gonna die what a cuties  good job,1,77
203,family members of osama bin laden have died in an airplane accident how ironic  mhmmm gov shit i suspect,1,104
204,man goes into airplane engine accident  via,1,43
205,horrible accident  man died in wings of airplane 29072015,1,57
208,a cessna airplane accident in ocampo coahuila mexico on july 29 2015 killed four men including a state of coahuila government official,1,134
209,horrible accident man died in wings airplane 29072015 watchthevideo,1,67
210,experts in france begin examining airplane debris found on reunion island  french air accident experts on wednesday,1,115
211,experts in france begin examining airplane debris found on reunion island french air accident experts on wednesday began examining t,1,132
212,kca votejkt48id mbataweel rip binladen family members who killed in an airplanes accident,1,89
213,i almost sent my coworker nudes on accident thank god for airplane mode,0,71
215,that or they might be killed in an airplane accident in the night a car wreck politics at its best,0,98
216,experts in france begin examining airplane debris found on reunion island french air accident experts on  mlb,1,109
218,this is unbelievably insane man airport airplane aircraft aeroplane runway accident freaky,1,90
219,horrible accident   man died in wings of airplane29072015,1,57
220,horrible accident man died in wings of airplane 29072015,1,56
221,usama bin ladins family dead in airplane crash naturally no accident,1,68
222,pilot dies in plane crash at car festival  via  crash aircraft airplane pilot death accident carfest,1,100
225,strict liability in the context of an airplane accident,1,55
226,dtn brazil experts in france begin examining airplane debris found on reunion island french air accident exp,1,108
229,experts in france begin examining airplane debris found on reunion island french air accident experts on wedn,1,109
231,horrible accident man died in wings of airplane 29072015 wtf you cant believe your eyes,1,87
232,nicole fletcher one of a victim of crashed airplane few times ago   the accident left a little bit trauma for her although shes,1,127
235,omg horrible accident man died in wings of airplane,1,51
237,omg i dont believe this rip bro airplane accident jetengine turbojet boing g90,1,78
238,experts in france begin examining airplane debris found on reunion island french air accident experts on wednesday began examining t,1,132
240,i had a airplane accident,1,25
241,my phone looks like it was in a car ship airplane accident terrible,0,67
242,statistically im at more of risk of getting killed by a cop than i am of dying in an airplane accident,0,102
243,airplane crashes on house in colombia 12 people die in accident,1,63
244,the shooting or the airplane accident,1,37
245,could a drone cause an airplane accident pilots worried about use of drones esp in close vicinity of airports,1,109
246,early wake up call from my sister begging me to come over amp ride wher in the ambulance to the hospital rodkiai,1,112
247,twelve feared killed in pakistani air ambulance helicopter crash,1,64
248,two air ambulances on scene of serious crash between two cars and lorry in      emsne,1,85
249,twelve feared killed in pakistani air ambulance helicopter crash  reuters  yugvani,1,82
251,leading emergency services boss welcomes new ambulance charity,0,62
252,anyone travelling aberystwythshrewsbury right now theres been an incident services at a halt just outside shrews ambulance on scene,1,131
253,twelve feared killed in pakistani air ambulance helicopter crash,1,64
254,ambulance sprinter automatic frontline vehicle choice of 14 lez compliant  ebay,0,79
256,new nanotech device will be able to target and destroy blood clots,0,66
258,it was hella crazy 3 fights an ambulance and a couple mosh pits,1,63
260,if i get run over by an ambulance am i lucky justsaying randomthought,0,69
261,news twelve feared killed in pakistani air ambulance helicopter crash  tilnow dna,1,81
262,twelve feared killed in pakistani air ambulance helicopter crash,1,64
263,waiting for an ambulance,0,24
264,you ok need a ambulance hahahah that was good,0,45
265,ambulance sprinter automatic frontline vehicle choice of 14 lez compliant  ebay,0,79
266,pakistan air ambulance helicopter crash kills nine,1,50
267,nissan are you ok do you need medical assistance i can call an ambulance if you need me to,0,90
268,ems1 ny emts petition for 17 per hour minimum wage  ems paramedics ambulance,0,76
269,twelve feared killed in pakistani air ambulance helicopter crash,1,64
270,twelve feared killed in pakistani air ambulance helicopter crash,1,64
271,ambulance sprinter automatic frontline vehicle choice of 14 lez compliant  ebay,0,79
272,ambulance sprinter automatic frontline vehicle choice of 14 lez compliant  ebay,0,79
273,check out whats in my parking lot he said that until last year it was an ambulance in st johns,0,94
274,when you dont know which way an ambulance is coming from ltlt,1,61
276,reuters twelve feared killed in pakistani air ambulance helicopter crash,1,72
277,twelve feared killed in pakistani air ambulance helicopter crash,1,64
279,why is there an ambulance right outside my work,0,47
280,this dog thinks hes an ambulance,0,32
281,happening now  hatzolah ems ambulance responding with dual sirens and,0,69
283,twelve feared killed in pakistani air ambulance helicopter crash,1,64
285,twelve feared killed in pakistani air ambulance helicopter crash,1,64
287,twelve feared killed in pakistani air ambulance helicopter crash  worldnews,1,75
289,twelve feared killed in pakistani air ambulance helicopter crash  worldnews,1,75
290,whats the police or ambulance number in lesotho any body know,0,61
291,i am surprised we still cannot standardised the clinical practice across the 11 nhs ambulance trust,0,99
293,twelve feared killed in pakistani air ambulance helicopter crash,1,64
294,people who try to jwalk while an ambulance is passing i hate you,0,64
296,the episode where trunks annihilated freiza is the cleanest shit ever he showed that nigga no mercy,0,99
297,they shall be annihilated and all of their petebests dessicated and laid bare then you shall kneel before me,0,108
298,uribe just annihilated that baseball mets,0,41
299,heysundowns were annihilated in their previous meeting with celticindeed its an improvement,0,91
301,mizzou has annihilated florida the past 2 seasons even ended muschamps career just cant compete with bama,0,105
302,annihilated abs,1,15
303,be annihilated for status education mba on behalf of a on easy street careen eovm,0,81
307,to luka they should all die all of them everything annihilated  alois trancy,0,76
309,have a good un fella sorry i wont be there to get annihilated with you,0,70
310,cop pulls drunk driver to safety seconds before his car is hit by train   via,1,77
312,you must be annihilated,0,23
313,cop pulls drunk driver to safety seconds before his car is hit by train   via,1,77
314,boom your country was just entirely annihilated by a h  britain,0,63
315,you would have been annihilated so you might as well thank,0,58
316,one thing for suregod has promised israel will not be annihilated butthe horror of iran wnukes,0,94
318,i guess thats ok for armenians since weve spent most of our history getting annihilated,1,87
320,70 years since we annihilated 100000 people instantly and became aware that we have the ability to annihilate the whole of humanity,1,131
321,day 1 of tryouts went good minus the fact i stopped quickly to get a short ball and annihilated my toenail injury even more,0,123
322,during the 1960s the oryx a symbol of the arabian peninsula were annihilated by hunters,1,87
327,to luka they should all die all of them everything annihilated  alois trancy,0,76
328,ready to get annihilated for the bucs game,1,42
329,people annihilated by last nights weather really philip thought you would have forecast that,1,92
330,domain other sophistication be annihilated closely uptotheminute feat zrnf,0,74
331,i seen judas priest in 2005 when rob came back scorpions as support fucking annihilated the place astonishing gig,0,113
332,officially skipping out on fantasticfourfant4sticwhatever the hashtag is its getting annihilated in reviews bummer,0,114
334,thus explaining why you were all annihilated but the few or in this case you the only survivor evolved and became godlike,1,121
335,just completely annihilated cech with paul keegan what a time to be alive,0,73
336,who then were annihilated by the legion itself the survivors of the imperfect hybrid project quickly formed a new secret cell,0,125
337,exactly thats why the lesnarcena match from summerslam last year was so great because brock annihilated a guy whos,0,114
338,cop pulls drunk driver to safety seconds before his car is hit by train   via,1,77
340,annihilated in damascus syrian army grinds alloosh and his gang into the manure pile,1,84
341,ok i wasnt completely forthright i may have also been in a food coma bc of the kebabtahinipickles i also annihilated wfries,0,123
344,a fun filled happyhour at simmons bar in camden with this handsome one  i got annihilated apart from this game,0,110
345,juanny beisbol sr annihilated that ball lgm,0,43
346,hell is just a fraction of his belief of total annihilation destruction of usa,1,78
347,maybe we should call israel and tell them were sorry are pres has sold them down the river to annihilation,0,106
348,evildead  annihilation of civilization,0,38
349,us national park services tonto national forest stop the annihilation of the salt river wild horse  via,0,103
352,annihilating quarterstaff of annihilation,1,41
353,world annihilation vs self transformation  aliens attack to exterminate humans,0,78
354,starmade stardate 3 planetary annihilation  via,1,47
355,us national park services tonto national forest stop the annihilation of the salt river wild horse  via,0,103
356,us national park services tonto national forest stop the annihilation of the salt river wild horse  via,1,103
358,can you please sign and share this petition to save wild horses in arizona,0,74
360,us national park services tonto national forest stop the annihilation of the salt river wild horse  via,1,103
361,please check into salt river horses help stop the annihilation about to happen without 54000 more signatureschange org thx,0,122
363,are souls punished withannihilation,0,35
364,not to mention a major contributor to the annihilation of israel,1,64
365,we need help horses will dieplease rt amp sign petitiontake a stand amp be a voice for them gilbert23,1,101
368,i reject the laws of the misguided false prophets imprison nations fueling self annihilation,0,92
370,us national park services tonto national forest stop the annihilation of the salt river wild horse  via,0,103
371,the annihilation of jeb christie amp kasich is less than 24 hours away please god allow me at least one more full day,0,117
372,we need helphorses will die please rt amp sign petition take a stand amp be a voice for them gilbert23,0,102
375,we need help horses will dieplease rt amp sign petitiontake a stand amp be a voice for them gilbert23,0,101
380,hey az sign this petition to save the wildhorses  tantonationalforest a  singalong is in order,0,94
381,stop the annihilation of the salt river wild horses  via,1,56
383,and hes the current nova in the bookslast i checkedhe was tied into the books in 2011 after rider died during annihilation,0,122
384,us national park services tonto national forest stop the annihilation of the salt river wild horse  via,0,103
386,please sign amp rt to save saltriverwildhorses,0,46
389,thanks  dante    do join us by following the  zone  johnny,0,58
390,world annihilation vs self transformation  aliens attack to exterminate humans,1,78
393,us national park services tonto national forest stop the annihilation of the salt river wild horse  via,0,103
394,us national park services tonto national forest stop the annihilation of the salt river wild horse  via,1,103
396,im gonna fight taylor as soon as i get there,0,44
397,ohh no fukurodani didnt survive the apocalypse bokuto feels horrible  my poor boy my ppor child,1,95
398,will there be another jocelyn birthday apocalypse,0,49
401,rt janenelson097 rt stephenscifi adaptation watch charlie humans apocalypse now now optioned for film sciencefiction,0,116
402,apocalypse please,0,17
404,another hour its august 05 2015 at 0802pm heres red rover zombie apocalypse 2014  internetradio collegeradi,1,107
406,i feel like me doing a pullup is one of the stages of the apocalypse,0,68
407,shes kinda hot played on the radio today whats next disease to all the apocalypse has started everyone be careful,0,113
409,but if its the apocalypse lol gf m8,0,35
410,i know its a question of interpretation but this is a sign of the apocalypse  i called it,1,89
412,julie  r is the apocalypse version of romeo  juliet warmbodies,0,62
413,the apocalypse is upon us,0,25
415,rt fittscott minecraft night lucky block mod bob apocalypse wither 20 amp more mod showcase popularmmos  vi,0,107
418,and so it begins day one of the snow apocalypse,1,47
419,rt ourmothermary short reading  apocalypse 211023   in the spirit the angel took me to the top of an enormous high mountain and,0,127
420,candylit imagine sarumi in a zombie apocalypse fighting back to back heart to heart conversations over the,0,106
421,rt zonewolf123 i liked a youtube video  minecraft night lucky block mod bob apocalypse wither 20 amp more mo,0,108
423,and thats because on my planet its the lone audience of the apocalypse,0,70
424,dad bought a dvd that looks like a science doc on the front but i read the back and its actually about the impending biblical apocalypse,1,136
426,it is indeed if the apocalypse comes this week i know where ill be,0,66
427,go look at grizzly peak right now it looks like the beginning of an dystopian apocalypse movie,0,94
429,my niece just asked me would you be scared if there was an apocalypse here,0,74
432,theres a storm over cairo in the latest xmen apocalypse set photo  via,1,70
435,minecraft night lucky block mod bob apocalypse wither 20 amp more mod showcase popularmmos  via,0,95
436,shot through the heart xv you are going to totally give love a bad name with this heart pierc,0,93
437,rt geekapocalypse 4pm gmt hesse plays dark souls 2 day 9   etcpb,0,64
438,i know where to go when the zombies take over,0,45
440,the latest from  reveals storm is a queen in apocalypse,1,55
442,shadow boxing the apocalypse,1,28
443,short reading  apocalypse 211023   in the spirit the angel took me to the top of an enormous high mountain and,1,110
444,enjoyed liveaction attack on titan but every time i see posters im reminded how freshly clean and coiffed everyone is in the apocalypse,0,135
445,i liked a  video  minecraft night lucky block mod bob apocalypse wither 20 amp more mod showcase,0,96
446,pbban temporary300 avysss armageddon  do not kill  flags only  fast xp for reason,0,81
