id,clean_text,target,text_length
5347,dont overwork yourself your album is gonna be fire just dont overwork or stress i love you take care,0,100
5349,i promise not to tax pancakes or rainbows or not dying in a fire,0,64
5350,this nigga cyhi diss was what meek was suppose to do this shit actually fire,0,76
5351,i wanna set some shit on fire,1,29
5352,in the words of charlie daniels fire on the mountain run boys run,1,65
5353,i just checked in  at on fire on  lovefood,1,42
5354,when your heart is bigger than the obstacles  in front of you euro dontexpectnothing july fire,0,94
5355,fire waves and darkness,0,23
5356,it may seem like our fire has been a little burnt out,0,53
5357,smelling a bon fire while driving makes me wanna be sitting near one making smores,1,82
5359,will be dropping fire selfie tomorrow saying youre welcome ahead of time,0,72
5362,fire call brant av  drummond rd for fire  structure  single units car 6 on call truck,1,85
5365,your psa for the day if a fire truck is behind you with lights going move over so they can get to their call,0,108
5366,rfp fire truck service body for f450 fire fighting rescue amp safety equipment transporta,0,89
5367,reno truck trailer catches fire in reno,1,39
5368,wild night in the village of pugwash every fire truck is out that the town has which is like a fire truck for every house population6,1,133
5371,an 18wheeler came along and struck the fire truck spinning it around 180 degrees and causing it to roll over,1,108
5372,sigalert update 3n133 closed at 5 fwy ufn trash truck fire,1,58
5373,didnt look like a murder scene just 1 cops a fire truck and 2 fire assistance cars along with a helicopter,1,106
5375,former township fire truck being used in philippines  langley times  philippines,1,80
5377,former township fire truck being used in philippines township of langley assistant fire chief pat walker spen,1,109
5378,our garbage truck really caught on fire lmfao,0,45
5379,on northgate by the taco truck thats fire,1,41
5380,its never a good sign when you pull up to work amp theres five ambulances amp a fire truck in the bay wompppp at least its friday,1,129
5381,fire truck and ambulance in k3 phase 3 hope everyones okay prayforsaipan,1,72
5382,sigalert north amp southbound 133 closed btwn 5 fwy and irvine blvd due to truck fire chp is detouring traffic,1,110
5383,true because of the truck that caught fire,1,42
5384,ohgod xd i didnt mean it so p but you have that fire truck in the back of you to make up for it so you good xd,0,110
5385,came across this fire video not mineenjoybabes way of saying hi to me while hes in the fire truck fireman,0,105
5386,133 n past  the 5 l lane is reopened all other lanes are closed all lanes are open on the 133 s trash truck fire cleanup,1,120
5387,sigalert north amp southbound 133 closed btwn 5 fwy and irvine blvd due to truck fire chp is detouring traffic,1,110
5389,found this cool photo not mine 1952 dodge wayne bodied 4 window bus  ex libby mt fire department truck all ori,1,110
5391,trident 90225 chevy fire truck w pumper  ims fire dept red ho 187  plastic,0,74
5392,toddler bedding firetruck bundle fire truck firefighter sticker decals sign wall,0,80
5396,when a monster truck racer catches on fire at the fair,1,54
5397,truck fire clogs canyon road,1,28
5400,rgj truck trailer catches fire in reno,1,38
5403,philippines former township fire truck being used in philippines   of emergency equipment in cebu philippi,1,106
5404,theres a fire truck in this parking lot,0,39
5406,evening sun article on nno,0,26
5407,choose to be happy fire truck the rest   review of kick push by,0,63
5408,former township fire truck being used in philippines  langley times  filipino,0,77
5409,jacksonville fire amp rescue engine 58  awesome truck  official jade fl  via,1,76
5410,njturnpike  njturnpike reopens hours after truck fire in,1,56
5411,lukebox something about first responders military they are our true heros besides your music,0,92
5412,im grateful for our first responders    and others  who acted so swiftly to save countless lives today,1,102
5413,praying for gods healing and safety of first responders,0,55
5416,join charity 10k run event  11am start sun 20 sept 2015 castle donington community first responders,0,99
5417,loved the way this book was written to include so many vantage points of first responders  kindle,0,97
5418,first responders would never be sent to the wrong address again w smartteks gpsbased panic button mpers safety,0,110
5420,we can help says denver firefighter working to curb first responder suicide,1,75
5423,whats cool is that teens are becoming what i like to call digital first responders for their friends who need a little help or support,0,134
5425,carmike cinemas on antioch shooting we are grateful for staff and first responders safety is highest priority,1,109
5426,rt roadid thanks to alex for his story amp to all first responders for being there when we need you,0,99
5428,i just added sandy first responders lost their homes to vip home page group on,1,78
5430,thankful for our first responders especially  for life saving response today in antioch,1,87
5432,juneau empire  first responders turn out for national night out,0,63
5437,i dont throw the word hero around lightly usually reserved for first responders and military but hes a hero,0,107
5439,us wants future first responders to be more hightech,0,52
5442,theres still room for you at our party for first responders from around the country 3rd annual best ever,0,104
5443,incase of accident the first responders would know that there is a baby present,0,79
5444,kirsten gillibrand     extend health care to 911 first responders,1,65
5445,we can help says denver firefighter working to curb first responder suicide,1,75
5446,first responders convene for national summit and awards on gis technology  gisuserpr geotech,0,92
5448,york co first responders compete to save lives in badges for blood paramedic ems,0,80
5449,some good info to help first responders cope individual resilience factsheet for responders,0,91
5450,no lives lost except those of first responders or the public theyre charged with protecting,1,91
5452,first responders get int  free on saturday details,0,50
5454,at the 999day emergency services display meeting the brave police firefighters and first responders that help keep us safe,1,122
5455,this week first responders and dart members are participating in a four day intensive technical large animal,1,108
5458,as firefighters make gains on rockyfire jerry brown is heading to the area to meet with first responders tomorrow morning,1,121
5459,after shooting event at the theater  is giving free coffee to all first responders police amp firefighters antiochhickoryhollowtn,1,129
5460,no lender fees for veterans or first responders past and present on,0,67
5461,new giant flames giant full black pantofel infoorder sms087809233445 pin23928835   pictwittercompnpizody,1,104
5462,new snap on tools black baseball hatcap silvergray embroidered s logo flames  full re,0,85
5465,new snap on tools black baseball hatcap silvergray embroidered s logo flames  full re,0,85
5466,vampiro going through the table of flames ultimalucha luchaunderground,0,70
5467,cabin fever 2 flames,0,20
5468,if you cant summon the flames directly from hell store bought is fineme  momdies,0,80
5469,just added some more fire to the flames for saturday rick wonder will be spinning a guest set along with chachi,0,111
5471,yoga flames,0,11
5473,sbnation flames what makes a good penalty killer,0,48
5475,i guess you can say igs hopes went up in flames,0,47
5476,ill cry until my pity partys in flames,0,38
5477,that new lil b x chance is nothing but flames,0,45
5479,i wish i was good enough to add flames to my nails im on fire,1,61
5480,my gang walking round with them brown flames  amp thats 100nd,0,61
5481,new snap on tools black baseball hatcap silvergray embroidered s logo flames  full re,0,85
5482,dude was just smoking and the fucking thing went up in flames i though a bomb went off omg scared,1,97
5484,maryland mansion fire that killed 6 caused by damaged plug under christmas tree report says  into the flames,1,108
5485,new giant flames giant manly brown infoorder sms087809233445 pin2327564d,0,72
5486,you see the devastation amp its shocking  firefighters continue to battle flames in california benstracy reports,1,112
5487,watching it go up in flames,1,27
5488,rp said they can see smoke coming from the silo on 260th street in hartford but no flames,1,89
5489,i chose you so if we can search for the joy of just the two of us well be near smiles no matter what cold flames burn our bod portgassdk,0,136
5491,maryland mansion fire that killed 6 caused by damaged plug under christmas tree report says  into the flames firefighters bravery,1,129
5492,everyone is setting flames upon me,0,34
5493,thats the optimistic side of me no doubt its tough but it can be done i feel like the games will pivot on defense,0,113
5494,maryland mansion fire that killed 6 caused by damaged plug under christmas tree report says  into the flames,1,108
5495,so pardon me while i burst into flames   ive had enough of the world and its peoples mindless games,0,99
5496,want to burst into flames anna hugged him tightly,0,49
5497,selmo u not catching flames from me  im just gonna be witnessing the slaughter,1,78
5498,bloody ell let it burn rubybot,0,30
5499,if you have an opinion and you dont put it on thh internet you will furst into flames,0,85
5501,i have a rising follower graph 2 more followers in the past week get your stats right here,0,90
5502,just between gray and ophelia red flames blazing around her person setting nearly everything in the area,1,104
5503,soloquiero maryland mansion fire that killed 6 caused by damaged plug under christmas tree report says  into the flames firefighte,1,130
5505,maryland mansion fire that killed 6 caused by damaged plug under christmas tree report says  into the flames,1,108
5506,you better make all your shots tomorrow cause im recording and flames will be thrown tomorrow,0,93
5507,i added a video to a  playlist  nicki minaj  up in flames official video,0,72
5509,he better than sean bro i can admit that sean is flames now but he better than sean,0,83
5510,the advantages apropos of in flames favorable regard mississauga ontario pwhvgwax,0,81
5514,flattened all cartoonylike whoa there papa,0,42
5515,the road to success is paved with pennies that i flattened on the train tracks youre welcome,0,92
5517,feel like ive been flattened by a sumo wrestler  no pain no gain muaytai wantmyabsback strong,0,93
5518,ideas in food flattened,0,23
5519,zouma has just flattened him there  cfc,0,39
5520,zouma has just absolutely flattened that guy,0,44
5521,flattened,0,9
5522,70 years ago the first atomic attack flattened hiroshima 3 days later it was nagasaki both war crimes to put moscow in its place,1,128
5524,today august 6th is the 70th anniversary of abomb little boy been dropped on hiroshima70000 killed outright as the city was flattened,1,133
5525,would have just flattened the little midget,0,43
5526,who said this yosemite sam or drumpf nobody ill vote for a flattened out rabbit skin ahuh huh  i always say,0,107
5528,when he flattened machidadid he lose that fightnope he lost fights to guys he shouldnt of lost to also,1,102
5529,floored4 flattened   early birds does get de cups  so lag bout pun de dock and watch ppl drink,0,94
5531,conklin being flattened shuffled feet instead of kick slide didnt get hands up into chest,0,89
5532,flattened thee striker,1,22
5534,picking up flattened hay men  masonite in wahpeton nd,0,53
5535,zouma just flattened that guy,0,29
5538,fylde building set to be flattened one of prestons city centre iconic buildings is disappearing from the skyline,0,112
5539,hide your kids hide your wife hes on the loose i thought i flattened you with a ball,0,84
5540,wouldve been great if mbiwa just flattened that little rat,0,58
5541,puckflattened ball lol,0,22
5544,i dont doubt it but it was his implicit statement in doing it that makes me want him flattened by a bus,0,103
5545,and flattened raynor  raynor was a balding imperfect biker marine not a emo generic western hero,0,96
5547,i think the risk of losing and getting her nose flattened has a lot to do with it,0,81
5548,mums literally just picked up her new car today and flattened the battery already trying to sort out the bluetooth  muppet,0,122
5552,notley flattened harper in his heartland harper imported tens of thousands of tfw slaves cost albertans jobs,0,108
5553,flattened frog,0,14
5554,imagine getting flattened by kurt zouma,0,39
5555,the fallacy is it is up to the steam roller its up to the object whether it will be flattened or not robertcalifornia thereisonlysex,0,132
5556,photo beach earrings beach jewelry vacation earrings keep calm and beach on earrings made with flattened,0,104
5557,100  1 mix new flat double sided linerless bottle caps you choose mix flattened  full re,0,88
5558,flat footballs more like he flattened the spartans from crushing them back in the day hail,0,90
5559,ever seen by far a dreamy look came over his face and his ears flattened as he started to walk slowly toward her youd,1,117
5560,100  1 mix new flat double sided linerless bottle caps you choose mix flattened  full re,0,88
5561,when fizzy is sitting in the regular flood seats  and no one knows who she is,0,77
5563,jkl cancels flash flood warning for bell harlan knox ky   wx,1,60
5564,spot flood combo 53inch 300w curved cree led work light bar 4x4 offroad fog lamp  full re,1,89
5565,spot flood combo 53inch 300w curved cree led work light bar 4x4 offroad fog lamp  full re,0,89
5567,a small flood with bigconsequences,1,34
5569,homecoming queen killed on way home from the prom by flood waters socialnews,1,76
5570,2pcs 18w cree led work light  offroad lamp car truck boat mining 4wd flood beam  full rea,0,89
5573,its been raining since you left me now im drowning in the flood you see ive always been a fighter but without you i give up,0,123
5575,yet still why did so many fish die in the worldwide flood i wonder,0,66
5576,and please dont flood poor s mentions hes put in his work,1,57
5577,spot flood combo 53inch 300w curved cree led work light bar 4x4 offroad fog lamp  full re,0,89
5578,but he didnt,0,12
5579,12 72w cree led work light bar alloy spot flood combo diving offroad 4wd boat  full read,0,88
5580,2pcs 18w cree led work light  offroad lamp car truck boat mining 4wd flood beam  full rea,1,89
5581,cue the flood of people ironically calling you that,0,51
5582,motors hot deals 452 gtgt  10x 27w 12v 24v led work light flood lamp tractor truck suv utv a,0,92
5584,85v265v 10w led warm white light motion sensor outdoor flood light pir lamp auc,0,79
5586,iembothfo  at 1000 am 2 nnw hana maui co hi county official reports coastal flood,1,81
5587,1 pair new 27w 4  round led work driving flood light offroad atv utv  full read by ebay,0,87
5588,2pcs 18w cree led work light  offroad lamp car truck boat mining 4wd flood beam  full rea,0,89
5589,internet basics the flood defective intertissue is soul mate the milk trench host guabxfv,1,89
5590,bmx issues areal flood advisory for shelby al till aug 5 900 pm cdt,1,67
5592,2pcs 18w cree led work light  offroad lamp car truck boat mining 4wd flood beam  full rea,0,89
5593,flood advisory in effect for shelby county in al until 9 pm alwx,1,64
5594,rt grantfactory grants funds weymouth meeting on seawalls and flood grants set for thursday night,1,97
5595,spot flood combo 53inch 300w curved cree led work light bar 4x4 offroad fog lamp  full re,0,89
5598,spot flood combo 53inch 300w curved cree led work light bar 4x4 offroad fog lamp  full re,0,89
5599,spot flood combo 53inch 300w curved cree led work light bar 4x4 offroad fog lamp  full re,0,89
5600,flood advisory issued august 05 at 428pm edt by nws  wxky,1,57
5602,survived the plague floated the flood just peeked our heads above the mud no ones immune deafening bells my god will we survive ourselves,0,137
5603,spot flood combo 53inch 300w curved cree led work light bar 4x4 offroad fog lamp  full re,0,89
5604,flood prone waterways in westchester county now eligible for millions in state aid newyork,1,90
5605,chinese rescue team arrives in myanmar to help flood victims  sittway,1,69
5608,flood advisory issued august 05 at 710pm cdt until august 05 at 800pm cdt by nws the urban and   weather,1,104
5609,12 72w cree led work light bar alloy spot flood combo diving offroad 4wd boat  full read,0,88
5611,rock springs  residents living off elk street continue to battle flooding issues after mondays rain storm while,1,111
5612,cuban leader extends sympathy to vietnam over flooding at,1,57
5613,business at the sponge docks washed out by rain flooding,1,56
5614,he thrusts a little more before he jams his cock deep inside her flooding her womb and pussy with his hot thick cum,0,115
5617,severe thunderstorms and flash flooding possible in the midsouth and midwest  weather environment climate nature,1,112
5618,1130a radar update widespread showersstorms but moving over the same areasminor flooding possible hunwx,1,103
5619,tips to prevent basement leaks  create control joints to eliminate random cracking homeimprovement flooding,0,107
5620,flooding,1,8
5621,no reported flooding po in the area ten4 mmda,0,45
5622,flooding kills 166 displace over one million in pakistan  daily news amp analysis  yugvani,1,90
5624,flooding kills 166 displace over one million in pakistan  daily news amp analysis,1,81
5625,laos flooding 10 villages underwater world vision responding,1,60
5626,floods ukfloods  british trekkers rescued amid flash floods in himalayas a group of british tr   flooding,1,105
5627,maybe the plan is to dilute until they can safely say we have to start charging or its over longs would come flooding in,0,120
5628,cuban leader extends sympathy to vietnam over flooding at,1,57
5629,ill only dm hotel info because people are flooding my notifications asking me for info,0,86
5631,when the waves are flooding the shore and i cant find my way home anymore thats when i look at you,1,98
5632,if flooding occurs in your home  how to stop mold growth via,1,60
5633,flooding of tracks caused derailment sa insubcontinent,1,54
5634,the chinese are flooding nyc market like never before,0,53
5635,obama keeps 27 iraqi christian asylum seekers ndetention while flooding us wunscreened muslims  via,1,99
5638,so grateful for all the support flooding in from  dinner guests thank you all,1,77
5641,there some flash flooding in madison valleywx,1,45
5642,is it too soon to start flooding your comment section with come to brazil comments bc i will,0,92
5644,and last year it was just a lot of the drums are flooding and janice im falling,0,79
5645,a burst water main causes major flooding at a birmingham hospital   omg,1,71
5646,heavy rainfall and flooding in northern vietnam  situation report no2,1,69
5647,oh my god the memories are flooding back,0,40
5650,flood disaster burst water pipe floods apartments at nycha senior center  ny1 ny1burst water pipe floods a,1,106
5651,lrt look at all my tom feels flooding back,0,42
5652,myanmar msf assisting thousands as worst flooding in decades hits parts of myanmar,1,82
5653,residents in the central part of ocean city heard from engineers about flood mitigation options tuesday ocnj,1,108
5654,wen i finally get the girl i want im flooding yall wit all pics of us rs tho,0,76
5655,i see her flooding at mad decent,0,32
5656,monsoon flooding kills dozens in myanmar prompting calls for help,1,65
5657,memorial unveiled for travis county deputy killed in sept flooding travis county sheriff greg hamilton joined,1,109
5658,flooding kills 166 displace over one million in pakistan   at least 166 people have been killed and nearly 11 lakh,1,114
5659,thankkk u all soo much for flooding my notificationsu my fella parsholics r superb amp jus soo awesomelove love u all always frvrgrateful,0,137
5661,slip sliding away  flash floods info for writers wtony nester  writingtips,1,74
5662,who is bringing the tornadoes and floods who is bringing the climate change god is after america he is plaguing her   farrakhan quote,1,133
5663,myanmar flooding heavy monsoon rains during the month of july have caused flooding flash floods and landsli,1,107
5664,in india 119000 people have taken shelter in the 966 relief camps the government has set up after the floods,1,108
5665,dont worry im sure climate has nothing to do with hail floods tornados in alberta amp ontario im sure gods just mad at you,1,122
5668,i never thought it would be a wtf moment yet its here after months of 90 degree heat next we will have flash floods,1,115
5669,granted like half my town floods when it rains but still whatever,1,65
5670,rspca site multiple 7 story high rise buildings next to low density character residential in an area that floods,0,112
5671,i hope that mountain dew erodes your throat and floods your lungs leaving you to drown to death,1,95
5672,disaster group stunned by floods,1,32
5673,theres this person amp they reckon when youre dying your brain floods with dmt causing you to relive your life in real time in a simulation,0,139
5674,have you ever remembered an old song something you havent heared for years  words that carry floods of memories all along priceless,0,131
5675,floods fishing finally sunshine amp fab deals from albertsons anniversary sale lauren paints  a beautiful life,0,110
5676,flood disaster bengal floods cm mamata banerjee blames dvc bjp claims state failed to use   economic t,1,102
5677,69 dead due to floods in myanmar naypyidaw aug 5 prensa latina the death toll rose today to 69 in myanmar,1,105
5680,typhoon soudelor approaches after 7 killed 2 missing in floods in philippines  via,1,82
5683,when it rains in nj it flash floods otherwise its just a desert of grief and taxes,1,82
5684,download  itunes  floods of glory by luiz santos jazz art music,0,63
5685,yep during floods of 1999 or 2000  clyde dam releasing every bit of water it could most speccy  ev charging your way,1,116
5686,bamenda floods kill animals birds,1,33
5687,i hope it rains throughout the whole weekend i hope it floods and the portaloos become sentient,0,95
5688,apc chieftain tasks dickson on n15b floods donation to bayelsa,1,62
5689,pagasa 712am yellow warning  panay island guimaras negros possible floods in lowlying areas amp landslides in mountainous areas,1,127
5690,rt 40hourfamine in bangladesh government has not declared floods an emergency worldvision will continue to m,1,108
5692,nearly 50 thousand people affected by floods in paraguay,1,56
5693,etp bengal floods cm mamata banerjee blames dvc bjp claims state failed to use relief funds even as flood w,1,107
5694,may allah help all those suffering from the pakistan floods you and your families are in our dua,1,96
5695,children in myanmar face a double catastrophe as floods hit the most,1,68
5698,love when drake floods instagram makes you feel real in tune with everything he did like you was there or sumn,0,110
5699,who is bringing the tornadoes and floods who is bringing the climate change god is after america he is plaguing her   farrakhan quote,0,133
5703,69 die in myanmar floods 250000 affected,1,40
5704,typhoon soudelor approaches after 7 killed 2 missing in floods in philippines  typhoon,1,86
5705,memphis always floods,1,21
5706,floods cause damage and death across asia  all media content    05082015,1,72
5707,gtas soon as maintenance ends everyone floods the servers gtservers destroyed by extreme load gtmaintenance starts anew,0,119
5710,who is bringing the tornadoes and floods who is bringing the climate change god is after america he is plaguing her   farrakhan quote,0,133
5711,e112 particulatebreak up of solid combust fossil fuel voltaic active forest fire biological vocpetroleum ch4 bacteria decomposition,1,131
5712,be careful anyone who lives west of beaverton forest grove has a rapidly spreading fire heading east,1,100
5713,i added a video to a  playlist  ori and the bind forest ep 6 fire and death,1,75
5714,how is it one careless match can start a forest fire but it takes a whole box to start a campfire,1,97
5715,our little forest fire wardens,1,30
5716,fire in pisgah national forest grows to 375 acres,1,49
5717,ashenforest floorburnt manzanita amp timber on johnson fire along ridge on forest road 1 routecomplex,1,101
5719,runs at her for setting my forest on fire and bites the shit out of her neck,1,76
5720,sets the forest on fire,1,23
5721,i liked a  video  j cole  fire squad 2014 forest hills drive,0,60
5722,view of smoke column rising above the south end of the blake fire along forest road 1 routecomplex,1,98
5724,it starts a forest fire that cannot be put out,1,46
5726,fire in pisgah national forest grows to 375 acres,1,49
5727,i had to grill for a school function one of the grills we had going was pretty much either off or forest fire no inbetween made it work,0,135
5729,515p for those who watch over me forest fire smoke has lifted nuff fme tmake a run tthe pet store on the hwy n ill bhome by 7p,1,126
5730,we are having forest fires out here in socal but the only fire you should watch for is  realhiphop,1,98
5732,us forest service firefighter david ruhl 38 died in the frog fire in the modoc national forest he had been temporarily reassigned,1,129
5733,usfs an acronym for united states fire service,0,46
5734,how is it one careless match can start a forest fire but it takes a whole box to start a campfire,0,97
5736,only you can prevent forest fires,1,33
5739,naturaldisasters as california fires rage the forest service sounds the alarm about rising wildfire costs,1,105
5740,q why do ducks have big flat feet a to stamp out forest fires q why do elephants have big flat feet a to stamp out flaming ducks,0,128
5741,wow where is this for the rest of the summer i usually have to worry about forest fires calgary is about 8 hours away,1,117
